brand,model,link,date,price,title,subtitle,f1,f2,f3,year,hp,range,kp,dtp,fuel,location,desc
bmw,series4,https://auto.ria.com/uk/auto_bmw_4_series_36763230.html,2024-12-16-14-11,18800, bmw 4 series 2014, f32, f32,,,2014,-1,156,1,1,1,Київ,"продаю свій перший автомобіль. машина була куплена в 2019 році з пробігом 48 тисяч км. другий власник в україні. не бита. авто повністю обслужене. останні пару років обслуговувалось на zolotoy garage. масло мінялося кожні 7-8 тисяч. технічно у відмінному стані, тільки після повного то. в наявності майже всі звіти по роботам за 4 роки. поміняно нове лобове скло. тільки зроблено косметичне фарбування переднього бампера, пластикових накладок під порогами, а також пофарбовані водійські двері (вимушене фарбування, впав шматок плитки з будівлі. є всі фото). по кузову та інтер'єру є не великі питання, машина потребує полірування та хімчистки.хороша комплектація:великий монітор, проекція, безключовий доступ, музика harman kardon, комплектація sport. усі деталі можна перевірити за він кодом.у 21-му році ставили 1 stage на upstage (364 к.с. на 571 нм)."
bmw,series4,https://auto.ria.com/uk/auto_bmw_4_series_37478294.html,2024-12-16-14-11,47900, bmw 4 series 2021, g22 • 430i steptronic (258 к.с.) • base, g22 , 430i steptronic (258 к.с.) , base,2021,258,16,1,1,1,"Одеса, Гранитная 1б","11 місяць 2021 рокуремонт виключно по ориганалу, всі чеки та квитанції в наявностібезключовий доступоптика bmw laserm-кермо з пелюсткамицифрова панель приладівкруїз контрольмультимедійний дисплей lcd2-х зонний клімат контрольпідігрів передніх сидінькамера заднього видупарктроніки 360помічник паркування"
bmw,series4,https://auto.ria.com/uk/auto_bmw_4_series_37195618.html,2024-12-16-14-11,36000, bmw 4 series 2018, f32 (fl) • 440i steptronic (326 к.с.) • base, f32 (fl) , 440i steptronic (326 к.с.) , base,2018,326,74,1,1,1,Київ,"продаю власний автомобіль пригнаний з сша (пошкодження можно оцінити на аукціонних фото, підводних каменів не було виявлено). по україні автівка їздила з вересня 2020 року, всі то проводились вчасно.комплектація з заводу:- амортизатори зі змінною жорсткістю- безключовий доступ- sport seats- асистенти (driving assistant, cruise control with braking function, lane change warning)- бездротовий carplay- акустика harman kardon- led фари- датчики сліпих зон- чорна стеля- люкдооснащення:- європейські дзеркала з підігрівом та автозатемненням- диски jr34 hyper black 19 різноширокі (8,5 перед 9,5 зад)- гальма перфоровані та вентильовані з більшими гальмівними дисками в порівнянні зі стоком- плівка teckwrap azure maya blue- stage 1 mg flasher та stage 3 коробка"
bmw,series4,https://auto.ria.com/uk/auto_bmw_4_series_37605440.html,2024-12-16-14-11,18990, bmw 4 series 2015, f32, f32,,,2015,-1,156,1,1,1,"Київ, вул. Михайла Гришка 4","в продажі bmw 428i 2015 року випуску.автомобіль продається від першого власника, присутня сервісна історіяна останньому регламентному то було зроблено заміну грм, гальмівних дисків та колодок, масла в двс.авто повністю в рідній фарбіпереоформлення будь-якого типу.можлива додаткова перевірка на сто.запрошуємо вас на огляд і тест-драйв!гарна комплектація:• адаптивна led оптика• led ходові вогні• датчики світла та дощу• задня оптика led• ел.регулювання сидінь з пам'яттю• підігрів сидінь• поперекова підтримка• 2-х зонний клімат-контроль• безключовий доступ• кнопка та система start/stop• мультимедійне кермо• мех.регулювання керма• великий монітор мультимедіа• круїз-контроль• вибір режимів руху (eco/normal/individual/sport)• підкермові пелюстки• преміальна акустика ""harman/kardon""• навігація• комфортне підсвічування салону• вставки з дерева• люк• ел.привід дзеркал зі складанням, підігрівом• камера заднього виду• парктроніки• bluetoothзателефонуйте нам, або напишіть у чаті autoria, viber або telegram і ми розповімо про авто детальніше.ми пропонуємо:• кредит• лізинг• trade-in• автовикуп• розрахунок криптовалютою• безготівковий розрахунок• пригон (європа, сша)• підбір авто• допомога в продажі• доставка по україні• допомога в переоформленні• підготовка до продажуможливий обмін на ваше авто, просто напишіть нам в чат.працюємо без перерв та вихідних.автосалон aвтоfocus(м.київ,михайла гришка 4а )"
bmw,series5,https://auto.ria.com/uk/auto_bmw_5_series_36746793.html,2024-12-16-14-11,42900, bmw 5 series 2018, g30 • m550i steptronic sport (530 к.с.) xdrive, g30 , m550i steptronic sport (530 к.с.) xdrive,,2018,530,98,1,1,1,"Івано-Франківськ, вул. Євгена Коновальця 148Б","id: 20898bmw m550i xdrive 2018 року є розкішним спортивним седаном з потужним двигуном і висококласними технологіями. ось його основні характеристики: двигун: 4.4-літровий v8 з подвійним турбонаддувом. потужність: 456 кінських сил. крутний момент: 650 нм. коробка передач: 8-ступінчастий автомат steptronic. привід: повний (xdrive). розгін 0-100 км/год: приблизно 4.0 секунди. максимальна швидкість: обмежена на рівні 250 км/год. особливості: інтер’єр: високоякісні матеріали, спортивні сидіння, багатофункціональне кермо. технології: інформаційно-розважальна система idrive з сенсорним екраном, навігація, підтримка apple carplay. безпека: адаптивний круїз-контроль, асистент утримання смуги руху, системи запобігання зіткнень. комфорт: клімат-контроль, преміальна аудіосистема, підігрів сидінь. цей автомобіль поєднує в собі розкіш і продуктивність, забезпечуючи динамічну їзду і комфорт в будь-яких умовах.можливий продаж в кредит та через криптовалюту.пропонуємо такі послуги:- доставка авто з сша, канади, європи;- перереєстрація авто на нового власника;- перевірка авто;- оформлення авто в кредит."
bmw,series5,https://auto.ria.com/uk/auto_bmw_5_series_36903978.html,2024-12-16-14-11,23900, bmw 5 series 2015, f10 (fl), f10 (fl),,,2015,-1,115,1,1,1,Дніпро (Дніпропетровськ),"продам свій власний автомобіль, 2016го модельного року, заводській m sports package (зовнішній і внутрішній вигляд, підвіска і т.д.,) все оригінальне! обслуговування тільки нещодавно зроблено, машина доглянута і в ідеальному стані що технічно, що естетично! потужній три літровий двигун, чудова комплектація! додаткові питання, дзвонить ."
bmw,series5,https://auto.ria.com/uk/auto_bmw_5_series_34535988.html,2024-12-16-14-11,7000, bmw 5 series 2004, e61, e61,,,2004,-1,395,1,0,0,Київ,"продаю авто в гарному стані. повністю обслужена. є незначні, які видно на фото. більш детальніша інформація по телефону"
bmw,series5,https://auto.ria.com/uk/auto_bmw_5_series_37612352.html,2024-12-16-14-11,37600, bmw 5 series 2017, g30 • 540i steptronic (340 к.с.) • m package, g30 , 540i steptronic (340 к.с.) , m package,2017,340,105,1,1,1,"Львів, вул. Кульпарківська, 222/2","id30264даний автомобіль можна оглянути завітавши у наш автосалон, який знаходиться у м. львів по вул. кульпарківська 222.компанія бос авто пропонує такі послуги як:- кредит !- лізинг !- оплата криптовалютою !- доставка авто з сша, канади, європи !- перереєстрація авто на нового власника !- перевірка авто на сто !- продаж авто в кредит та лізинг !- оплата криптовалютою !- страхування !- обмін на авто !- тест-драйв !телефонуйте та наші менеджери з радістю нададуть відповідь на всі ваші запитання.чекаємо вас за адресою м. львів, вул. кульпарківська 222 наш графік роботи пн-пт – 10:00 год – 19:00 год. суб. – 10:00 год. – 18:00 год. нд. – 10:00 год. – 16:00 год."
bmw,series5,https://auto.ria.com/uk/auto_bmw_5_series_37489070.html,2024-12-16-14-11,8499, bmw 5 series 2002, e39 (fl) • 540i at (286 к.с) • base, e39 (fl) , 540i at (286 к.с) , base,2002,-1,351,1,0,1,Львів,"до вашої уваги bmw e39 540lмашина в одній сімї із 2007 рокузроблено все і навіть більшев машинки за все її існування 2 власниказроблено безліч робітмотор відкапіталений 30 тис томукузов без жодного рижикакоробка переключає ідеально без пинків і дьорганьпоставлений м бампер з губоювідреставровані фаризроблений басистий та гучний вихлоптитани р19 на низькопрофільні зимовій гумівстановлений газ 5 поколіннясалон в хорошому станім кермочудова акустикаламаующі спинкиелекто регулювання підголовникапамять сидітьелектро регулювання кермата багато іншогоготовий до любих перевірокпри потребі телефонуйте цікавтесь, скину більше фотографійстан автомобіля 10/10"
bmw,series5,https://auto.ria.com/uk/auto_bmw_5_series_37348882.html,2024-12-16-14-11,29900, bmw 5 series 2017, g30 • 520d efficientdynamics edition аt (190 к.с.) • m package, g30 , 520d efficientdynamics edition аt (190 к.с.) , m package,2017,190,149,1,0,0,"Одеса, вулиця Посмітного, 11","s337 m спортивний пакетs715 m аеродинамічний пакетs403 скляний дах, електроустаткуванняs416 роликовий сонцезахисний козирок, задній бічнийs423 килимки велюровіs428 трикутник аварійної зупинки та аптечка першої допомогиs453 сидіння з клімат-контролем, передніs456 комфортне сидіння з пам'яттюs465 система наскрізного завантаженняs4aw панель приладів sensatecs4ha підігрів сидінь спереду та ззадуs4lh оздоблення із цінних порід дерева «fineline cove»s4nb автомат. клімат-контроль із 4-зонним управліннямs4t8 зовнішнє дзеркало з автоматичним затемненнямs4ur внутрішнє освітленняs601 функція тбs609 професійна навігаційна системаs610 проекційний дисплейs650 cd-привідакустична система s676 hifis699 код міста 3 для dvds6ac інтелектуальний екстрений викликs6ae телесервісислужби підключеного диска s6aks6an консьєрж-послугивіддалені послуги s6apпідготовка s6cp apple carplayтелефонія s6nv з бездротовою зарядкоюs6u8 керування жестами bmws6uh інформація про дорожній рухs6wb багатофункціональний дисплей приладівs552 адаптивна світлодіодна фараs575 додаткові розетки 12 вs5a1 світлодіодні протитуманні фариs5ac помічник далекого світлаs5al активний захистs5ap декодування антивідблиску помічника далекого світлаs5at помічник водіння плюссистема допомоги під час паркування s5dn pluss5ds аварійний випуск, багажне відділенняs5dv парковка з дистанційним керуваннямs212 устаткування, гальмівна система. для конкретної країниs225 стандартна підвіскаs248 обігрівач рульового колесаs255 спортивне шкіряне кермоs258 шини із властивостями run flats2te автоматична коробка передач з підрульовими перемикачамиs2vb індикатор тиску в шинахs316 автоматичний механізм кришки багажникаs322 комфортний доступs3ds ключ дисплея bmws3mb індив. зовніш. лінія полірований алюмінійs8s3 автоматичне блокування під час запускуs8tf активний захист пішоходівs775 стеля антрацитова"
bmw,series5,https://auto.ria.com/uk/auto_bmw_5_series_37328221.html,2024-12-16-14-11,7499, bmw 5 series 2008, e61 (fl) • 520d мт (177 к.с) • base, e61 (fl) , 520d мт (177 к.с) , base,2008,-1,351,0,0,0,"Київ, Дніпровська набережна 17-Ж","авто в нормальному стані на свої роки!!!просторий, дизельний універсал який дарує приємні емоції від керування!!!технічно авто сів та поїхав!!!докладніше на всі запитання відповість менеджер - рибак роман шепель дмитрозапрошуємо вас пройти тест-драйв автомобіля за попереднім записомтакож ми надаємо послуги:- trade-in/обмін;- реалізація вашого авто;- кредит/лізинг;- доставка авто;- придбання авто за безготівковим розрахунком;"
bmw,series5,https://auto.ria.com/uk/auto_bmw_5_series_37203523.html,2024-12-16-14-11,8300, bmw 5 series 2003,,,,,2003,-1,237,0,0,1,Луцьк,"пригнаний з німеччини! 15 тис.км пробіг по україні! таких в продажі немає! ідеальніший стан на свої роки! сама максимальна комплектація! комфортні ламані сидіння, пам?ять сидінь, люк, ксенон, клімат. шкіра як нова! по авто працює кожна кнопочка на місці кожна пластмасочка. безпроблемний бензиновий двигун! оригінальний пробіг! 2 ключа. стан приємно вас здивує! за машиною дивився дуже добре, на обслуговування грошей не жалів! багато роботи було зробленого! технічно нова машина! естетично дуже крутий стан! таких авто вже нероблять. якість матеріалів та кайф від водіння вам гарантовано!"
bmw,series5,https://auto.ria.com/uk/auto_bmw_5_series_37177339.html,2024-12-16-14-11,14900, bmw 5 series 2010, f10 • 530d steptronic (245 к.с) • base, f10 , 530d steptronic (245 к.с) , base,2010,-1,287,1,0,0,Первомайськ • Миколаївська обл.,"машина у відмінному стані,обслужена,3.0 дизель 8 ст автомат,екологія на місці.є декілька косметичних підкласів нічого критичного.по техніці все добре.мотор,коробка,ходова питань нема все обслужене всі росходніки мінялися завчасно.по електроніці все добре всі асистенти працюю,помилок немає.авто готове до любої перевірки.дуже приємна витрата палива (траса 6.5-7.5) (місто 8.5-9.5)торг.телефонуйте все детально розповім.на обмін машина 16 тисяч."
bmw,series5,https://auto.ria.com/uk/auto_bmw_5_series_36907429.html,2024-12-16-14-11,14400, bmw 5 series 2012, f10 • 520i steptronic (184 к.с) • base, f10 , 520i steptronic (184 к.с) , base,2012,-1,194,1,0,1,Кам'янець-Подільський • Хмельницька обл.,
bmw,series7,https://auto.ria.com/uk/auto_bmw_7_series_37612501.html,2024-12-16-14-11,2000, bmw 7 series 1991,,,,,1991,-1,300,1,0,1,Первомайськ • Миколаївська обл.,"продам авто ,або обмін.потрібен ремонт коробки,є додаткова коробка,і комплект колес бербет.решту питань по телефону 09******25"
bmw,series7,https://auto.ria.com/uk/auto_bmw_7_series_37203754.html,2024-12-16-14-11,37000, bmw 7 series 2017, g12 • 730ld steptronic (265 к.с.) • base, g12 , 730ld steptronic (265 к.с.) , base,2017,265,140,1,0,0,Київ,"продам офіційний автомобіль,купувався на авт баварія.вся історія обслуговування присутня.на 130тис.км було зроблене велике то.пробіг оригінальний 100%,привід задній,всі ключі присутні.по кузову ціленька ні одна деталь не крашена,перед авто в захист ні плівці.автомобіль в гарному технічному та візуальному стані,вкладень не потребує.всі деталі по тел.торг присутній."
bmw,series7,https://auto.ria.com/uk/auto_bmw_7_series_35618318.html,2024-12-16-14-11,32000, bmw 7 series 2014, f02 (fl) • 740ld steptronic (313 к.с.) xdrive, f02 (fl) , 740ld steptronic (313 к.с.) xdrive,,2014,313,220,1,0,0,Мукачево • Закарпатська обл.,
bmw,series7,https://auto.ria.com/uk/auto_bmw_7_series_31917666.html,2024-12-16-14-11,9500, bmw 7 series 2003, e66, e66,,,2003,-1,500,0,0,1,Одеса,максимальная комплектация хорошее состояние 1000 назад поменяны фильтра масла все катушки все диски колодки тормозные все обслужено обслужен весь мотор поменяны все прокладки и сальники все в оригинале коробка после ремонта 20000 т все работает хорошо диски 17 с зимней новой резиной летние 18 новая резина есть запасной мотор с пробегом 260 т полностью обслужен все новое стоит торг писать телеграмм ватсап нахожусь за границей
bmw,series7,https://auto.ria.com/uk/auto_bmw_7_series_37460756.html,2024-12-16-14-11,14500, bmw 7 series 2013, f01 (fl) • 740i steptronic (320 к.с.) • individual, f01 (fl) , 740i steptronic (320 к.с.) , individual,2013,320,182,0,0,1,Вінниця,"автомобіль дуже доглянутий, жодних нюансів по технічному та візуальному стані не має. в більшості випадках обслуговувася на офіційному дилері, авто мало належне обслуговування і усе замінювалось вчасно. передня частина авто (капот, фари, бампер) затягнуті у бронеплівку.салон автомобіля збережений, тріщин, царапин не має. абсолютно усе працює. додаю ще комплект зимових шин (стан майже нові). на усі додаткові питання відповім по телефону."
bmw,series7,https://auto.ria.com/uk/auto_bmw_7_series_37612197.html,2024-12-16-14-11,2000, bmw 7 series 2000, e38 (fl) • 730d steptronic (193 к.с.), e38 (fl) , 730d steptronic (193 к.с.),,2000,193,276,1,0,0,Житомир,потрібно акб авто на мені деталі по телефону
bmw,series7,https://auto.ria.com/uk/auto_bmw_7_series_37611754.html,2024-12-16-14-11,5000, bmw 7 series 1999, e38 (fl) • 740i steptronic (286 к.с.) • base, e38 (fl) , 740i steptronic (286 к.с.) , base,1999,286,380,1,0,1,Кам'янське (Дніпродзержинськ) • Дніпропетровська обл.,"продам власне авто в хорошому стані все працює на ходу кожен день , по кузову и ходовій нічого робити не потрібно, салон в хорошому стані кожна кнопка працює хороша комплектація, продаю у зв'язку з тим що потрібні гроші на лікування після поранення готовий на обмін на авто дешевше з вашою доплатою"
