brand,model,link,date,price,title,subtitle,f1,f2,f3,year,hp,range,kp,dtp,fuel,location,desc
vw,touareg,https://auto.ria.com/uk/auto_volkswagen_touareg_35618178.html,2024-12-16-14-10,20200, volkswagen touareg 2010, ii покоління • 3.0d at (240 к.с.) 4motion • premium life, ii покоління , 3.0d at (240 к.с.) 4motion , premium life,2010,240,320,1,0,0,Ковель • Волинська обл.,"машина пройшла повне технічне обслуговування, було замінено комплект привідного цепу грм та зірочки. масла та фільтри також замінено 2 тис.км. тому. в наявності два ключі,сервісна документація та оригінальна сервісна книга. лакофарбове покриття,салон,підвіска,двигун та коробка передач в ідеальному стані,машина вкладень не потребує.встановлено тюнінгову систему вихлопних газів,рідний каталізатор та сажевий фільтр на місці. машина свіжопригнана,увесь пробіг був по атобанах європи.з додатковими питаннями можете звертатись в вайбер та ватсап."
vw,touareg,https://auto.ria.com/uk/auto_volkswagen_touareg_37611986.html,2024-12-16-14-10,26700, volkswagen touareg 2011, ii покоління, ii покоління,,,2011,-1,252,-1,0,0,Запоріжжя,"продам volkswagen touareg 3.0tdiдуже економне та комфортне автовесь автомобіль в рідній фарбівчасне обслуговування та правильна експлуатація зберегли його в такому стані до нашого часуготовий на будь-які перевіркиавто дуже м'яке у ходу за рахунок пневмопідвіскиадаптивна оптика, підігрів руля, дзеркал та сидіньвсі подробиці за телефономхто шукав живий таурег, то це саме вінофіціал!реальному покупцеві в подарунок комплект дисків з новою резиною гудієр"
vw,touran,https://auto.ria.com/uk/auto_volkswagen_touran_37042624.html,2024-12-16-14-10,18500, volkswagen touran 2019, ii покоління • 2.0d at (150 к.с.) • highline, ii покоління , 2.0d at (150 к.с.) , highline,2019,150,270,1,0,0,"Харків, Площа Юрія Кононенка 1а.",авто в ідеальному стані!гарний зовнішній вигляд!доглянутий салон!дуже гарна комплектація!гарна гума!технічно без найменшого зауваження!вкладень не потребує зовсім!дуже надійний двигун!можливий обмін на ваше автоможливий продаж в кредит або лізинг
vw,touran,https://auto.ria.com/uk/auto_volkswagen_touran_37060734.html,2024-12-16-14-10,13800, volkswagen touran 2012, i покоління (2nd fl), i покоління (2nd fl),,,2012,-1,193,1,0,0,Рівне,"vw touran 2012р. 13800$перший власник в україні, авто купував в німетчинікомплектація s lineпробіг при купівлі авто- 179970 кмпробіг зараз - 193000 кмдвигун – дизель 2.0, 125кв.коробка: : автомат dsg-6 з мокрим зчепленнямобслуговане до дрібниць і не вимагає вкладень, готові до будь-яких перевірок.комлектація/роботи:• 7місць• шкіра• панорама• люк на декілька положень/майже кабріолет/• двухзон. клімат• підігрів передніх сидінь 3х рівневий• автопарковщик (360)-камера задн. виду, передні /задні парктроніки• 17’’ диски• нова гума (пробіг приблизно 5000км)• датчики тиску в шинах• датчик рівня омиваючої вікна редини• датчик світла• датчик дощу• дзерлака- складання, нахил дзеркал при їзді назад• омивач фар• led ходові• противотуманки (працюють разом обо я к підсвітка повороту кожна окремо)• задній омивач скла та двірник.• вебасто• bluetooth – гучний зв“язок.• media in• aux in• сигналізація заводська.• заводське тонування скла• 2 розетки 12v- в салоні( другий ряд) та в багажнику• прикурювач. ( в авто не палили)• компресор+піна• вогнегасник+стоп+аптечка+домкрат• нові колодки• заміна грм. є відео заміни• заміна масла в коробці/двигуні. є відео заміни. важливо !!! при заміні масла в коробці дотримувались технологичних рекомендацій vw.• підвіска- повністю в ідеальному стані.• кузов: робився підкрас дверки в німеччині з правої пасажирської стороні. снизу та по всім сторонам немає жодної їржі.• авто дуже економічне. є відео/фото дісплея з показниками расходу палива.тел. (whatsapp, viber)"
vw,touran,https://auto.ria.com/uk/auto_volkswagen_touran_37612193.html,2024-12-16-14-10,365000, volkswagen touran 2008, i покоління (fl), i покоління (fl),,,2008,-1,170,1,0,1,"Київ, вул. Велика Кільцева, 58, Софіївська Борщагівка"," автомобіль volkswagen touran 2008 року. доступний в кредит, можливий обмін на ваше авто, або викуп вашого авто, страховка на місці. повний документальний супровід. комфортний критий автосалон, відкриті 7 днів на тиждень. пишіть нам у viber/telegram/whatsapp на мобільні номери, що вказані в оголошенні."
vw,touran,https://auto.ria.com/uk/auto_volkswagen_touran_32885411.html,2024-12-16-14-10,7800, volkswagen touran 2008,,,,,2008,-1,219,0,0,0,Тернопіль,"автомобіль придбаний у німеччині, не для бізнесу, для себе.все рідне, вкладень не потребує.економна, швидка, вмістима!дзвоніть, торгуюсь!"
vw,touran,https://auto.ria.com/uk/auto_volkswagen_touran_37455136.html,2024-12-16-14-10,5400, volkswagen touran 2005, i покоління • 1.6 mt (115 к.с.) • base, i покоління , 1.6 mt (115 к.с.) , base,2005,115,290,0,0,1,"Червоноград, Степана Бандери, 24А","віддамо в хороші руки volkswagen touran 2005 року з бензиновим двигуном 1.6, механічною коробкою передач, переднім приводом.автомобіль у хорошому технічному стані, регулярно проходив технічне обслуговування. двигун працює без нарікань, механічна коробка передач функціонує чітко, без сторонніх шумів і збоїв. не потребує додаткових вкладень!!!надійний, економічний та просторий міні-вен.ідеальний для міських умов та зручний у керуванні навіть на слизьких дорогах.розхід пального:місто: 6-7 л/100 кмтраса: 5-6 л/100 кмкомплектаціія: бортовий комп'ютер, електросклопідйомники, кондеціонер, магнітола та багато іншого.авто в наявності на нашому автомайданчику у м. шептицький (червоноград), вул. степана бандери, 24а (біля епіцентру).тут ви зможете протестувати авто, отримати консультацію експерта та допомогу з усіма документами. ми робимо процес покупки максимально простим і комфортним!пишіть або телефонуйте – відповімо на всі ваші запитання!"
vw,touran,https://auto.ria.com/uk/auto_volkswagen_touran_36166153.html,2024-12-16-14-10,9350, volkswagen touran 2013, i покоління (2nd fl) • base, i покоління (2nd fl) , base,,2013,-1,393,1,0,0,Долина • Івано-Франківська обл.,машин обслужена поміняв ремінь привода помпа насос масляний з ремнем новий демфер машина в ідеальнім стані масло і фільтер поміняний мотор і коропка робить ідеально запасні літьні колеса
vw,touran,https://auto.ria.com/uk/auto_volkswagen_touran_36804246.html,2024-12-16-14-10,9500, volkswagen touran 2010, i покоління (2nd fl) • 1.6tdi dsg (105 к.с.) • trendline, i покоління (2nd fl) , 1.6tdi dsg (105 к.с.) , trendline,2010,105,320,1,0,0,Косів • Івано-Франківська обл.,
vw,touran,https://auto.ria.com/uk/auto_volkswagen_touran_34810615.html,2024-12-16-14-10,7000, volkswagen touran 2007, i покоління (fl), i покоління (fl),,,2007,-1,300,0,0,0,Черкаси,"авто обслуговувалось вчасно. турбіна відреставрована. кондиціонер працює. підігрів двигуна (вебасто) працює, тому взимку в салоні не холодно. якісні чохли та килимки в салоні. сколи та подряпинилфп присутні (машина не щойно з автосалону). ремені, роліки, свічки накалу мінялись на пробігу 263 тис.км. я власник. торг символічний (на каву). продаж не терміновий"
vw,touran,https://auto.ria.com/uk/auto_volkswagen_touran_37348602.html,2024-12-16-14-10,11500, volkswagen touran 2012, i покоління (2nd fl) • 2.0d at (110 к.с.), i покоління (2nd fl) , 2.0d at (110 к.с.),,2012,110,266,1,0,0,Вараш (Кузнецовськ) • Рівненська обл.,"продаю хороший зручний та комфортний автомобіль. рік випуску 2012. у 2022 р був власноруч пригнаний з литви. придбаний там у порядної сім’ї а не в торгашів чи на автобазарі.тобто я є першим власником авто в україні. відразу були замінені всі замінники на хороші, бо все робив як себе. всі масла і ремені, помпа, демфер. зауважень до авто немає, все працює ідеально. пробіг не перевіряв чи оригінальний, так, як не було в тому потреби. причина продажу: потрібне більше авто.фаркоп наявнийдва ключісервісна книжкатой хто придбає цей автомобіль ніколи не пожалкує а буде лиш задоволений.комплект вже літньої гуми на титанових дисках."
vw,touran,https://auto.ria.com/uk/auto_volkswagen_touran_37036619.html,2024-12-16-14-10,2900, volkswagen touran 2004, i покоління • 1.6 mt (115 к.с.) • base, i покоління , 1.6 mt (115 к.с.) , base,2004,115,303,0,1,1,Харків,"продам своє авто, у користуванні 5 років після першої реєстрації з нідерландів. два рідних ключа, книга. по машині було зроблено багато - меньше місяця як були замінені дві ступиці, нові колодки, перебрані гальма, зпереду зліва - усі сайлентблоки, шарова, опорний підшипник. на праву сторону лежить комплект. перед цім - всі амортизатори, пружини, передні опори, проставки для кліренсу, метал. захист двигуна. 35 тис. тому встановлений комплект зчеплення - sachs, стійки стaбілізаторів. 25 тис тому - ремінь із роликами. 6 тис тому замінене мастило в коробці, оригінальне. свічки beru z300, масло в двигуні - motul gen2, заміна була 2 тис. назад, до цього - заміна кожні 8 тис з усіма фільтрами. безпека ціла, в машині 10 подушок. не гнила, у рідній фарбі, крашена була ляда. влітку промивались радіатори. помилки є по куту заслонок та датчику озоту, на роботу двигуна не впливають. каталізатор стоїть ще рідний, перевіряли 10 тис. тому, є відео - у гарному стані. газ не встановлювався, заправлявся на wog, масла не бере. витрата палива по місту 7-8, за містом 5,5-6.5. коробка 6 ступ. всі вікна у машини рідні, навіть лобове. після дтп необхідна заміна лівої чверті, лівих фар, задньої лівої підвіски. нові чохли, кілимки ева та є рідні. можливе будь яке переоформлення"
vw,egolf,https://auto.ria.com/uk/auto_volkswagen_e_golf_36907563.html,2024-12-16-14-10,10500, volkswagen e-golf 2014, vii покоління/typ 5g, vii покоління/typ 5g,,,2014,-1,131,1,0,-1,Стрий • Львівська обл.,продаю власний електромобільце чудовий варіант використання у місті.автомобіль має мінімальні потертості по кузову від використанняпричина продажу - хочу придбати електромобіль з більшим запасом ходуобмін присутній
vw,egolf,https://auto.ria.com/uk/auto_volkswagen_e_golf_37440627.html,2024-12-16-14-10,13600, volkswagen e-golf 2018, vii покоління (fl)/typ 5g • 35.8 kwh (136 к.с.), vii покоління (fl)/typ 5g , 35.8 kwh (136 к.с.),,2018,136,180,1,0,-1,Івано-Франківськ,"автомобіль у відмінному технічному стані , вся електроніка справнівираховували ємність - то батерея приймає 30.1 кіловатдтп відсутніходова - справнакомплектація хороша :• авто світло• авто дощ• парктроніеи перед+ зад• камера заднього ходу• підігрів дзеркал• термо скло• підігрів сидінь• адаптивний круїз контрольприсутнє тонування усіх віконзроблено антихромзамінені хромовані емблеми на чорні"
vw,egolf,https://auto.ria.com/uk/auto_volkswagen_e_golf_37488896.html,2024-12-16-14-10,17200, volkswagen e-golf 2018, vii покоління (fl)/typ 5g • 35.8 kwh (136 к.с.) • highline, vii покоління (fl)/typ 5g , 35.8 kwh (136 к.с.) , highline,2018,136,35,1,0,-1,Дніпро (Дніпропетровськ),авто пригнане на замовлення з німеччини. в україні проїхало 11 000 км. практично повна комплектація (відсутня лише шкіряний салон та запуск із кнопки). повна мультимедіа з актуальними картами україни та європи. тепловий насос. контурне підсвічування салону. два комплекти гуми та килимків у комплекті. і багато інших опцій. автомобільних бізнесменів прохання не турбувати.
vw,egolf,https://auto.ria.com/uk/auto_volkswagen_e_golf_36907268.html,2024-12-16-14-10,9500, volkswagen e-golf 2014, vii покоління/typ 5g • 24.2 kwh (115 к.с.) • highline, vii покоління/typ 5g , 24.2 kwh (115 к.с.) , highline,2014,115,85,1,0,-1,Хмельницький,свіжопригнана із європи і поставлена на облік!!!виїхав із автосалону у 2015р.не битий / не фарбованийпробіг 80 тис.км170 км запас ходу.швидкісна зарядка ccs2сервісна книга.один власник.два ключі.титанові диски розбірні r17багата комплектація.камера.парктронік 360.автоматичне паркування.адаптивний круїз-контроль.безключовий доступ.підігрів сидінь.підігрів лобового скла.led фари.клімат-контроль.
vw,egolf,https://auto.ria.com/uk/auto_volkswagen_e_golf_34282782.html,2024-12-16-14-10,19900, volkswagen e-golf 2018, vii покоління (fl)/typ 5g • 35.8 kwh (136 к.с.) • base, vii покоління (fl)/typ 5g , 35.8 kwh (136 к.с.) , base,2018,136,57,1,1,-1,Дрогобич • Львівська обл.,"трансмісія• рульове управління з електричним підсилювачем і датчиком швидкості• передні та задні стабілізатори поперечної стійкості• передній привід• диференціал обмеженого ковзання з приводом гальма• двигун 100 квт, 136 к. с. zev electric, включаючи: літій-іонний акумулятор ємністю 35,8 квт/год.• регенеративні 4-колісні дискові гальма з 4-колісною abs, передніми вентильованими дисками, сист допомоги при гальмуванні, контролем утримання на горі та електричним стоянковим гальмомекстер'єр• світлодіодні стоп-ліхтарі• світле тонов скло• переднє лобове скло включно: скло з електропідігрівом•• чутливі до швидкості склоочисники зі змінною періодичною функцією виявлення дощу з підігрівом• колеса: 16"" розділені 5-спицеві• передній бампер у колір кузова з хромованою вставкою в бампер• бічні дзеркала з електроприводом і підігрівом з ручним складанням та індикатором повороту• задній бампер у колір кузова з хромованою вставкою в бампер• заднє скло зі склоочисником і розморожувачем• повністю автоматичні аерокомпозитні галогенні денні фари із затримкою вимкненняінтер'єр• аналоговий дисплей•• дзеркало заднього виду ""день-ніч"".• затримка живлення аксесуарів• комфортні передні сидіння з підігрівом• внутрішнє оздоблення металева вставка панелі приладів• іммобілайзер двигуна• внутрішнє освітлення, що зникає• кермова колонка з ручним нахилом/телескопією• круїз-контроль, керування на кермі• двозонний передній автоматичний кондиціонер• шкіряне кермо• матеріал перемикання передач зі шкірою/металом• датчик зовнішньої температури• 3 розетки постійного струму на 12 врозваги• радіо, регулятором гучності з компенсацією швидкості, composition media з 8-дюймовим сенс. екраном - у тому числі: am/fm/hd radio, wma/mp3/flac/cd-програвач, usb-вхід, голосове керування, аудіосистема з 8 динаміками, інтеграція смартфона vw car-net app-connect та інтерфейс з apple carpl"
vw,egolf,https://auto.ria.com/uk/auto_volkswagen_e_golf_37611393.html,2024-12-16-14-10,9500, volkswagen e-golf 2015, vii покоління/typ 5g • 24.2 kwh (116 к.с.) • comfortline, vii покоління/typ 5g , 24.2 kwh (116 к.с.) , comfortline,2015,116,104,1,0,-1,Хмельницький,авто в чудовому стані. обслужене. чесний пробіг.два комплекти коліс. зарядка в комплекті.салон після хімчистки.причина продажу - третій електрокар в сім?ї
vw,egolf,https://auto.ria.com/uk/auto_volkswagen_e_golf_36452676.html,2024-12-16-14-10,15350, volkswagen e-golf 2020, vii покоління (fl)/typ 5g • 35.8 kwh (136 к.с.) • highline, vii покоління (fl)/typ 5g , 35.8 kwh (136 к.с.) , highline,2020,136,93,0,0,-1,Львів,"пригнаний з німеччини .чистий 2020рікє все крім шкіри, дінаудіо та безключевого.тепловий насосдуже збережений стан.додатковий комплект коліс.колір перламутровий.камера та всі можливі асистенти.детальніше по телефону."
vw,egolf,https://auto.ria.com/uk/auto_volkswagen_e_golf_36081027.html,2024-12-16-14-10,13499, volkswagen e-golf 2017, vii покоління (fl)/typ 5g • 35.8 kwh (136 к.с.), vii покоління (fl)/typ 5g , 35.8 kwh (136 к.с.),,2017,136,60,1,0,-1,Київ,"ємність акумулятора 36квт. авто в ідеальному стані. з таким невеликим пробігом авто залишилось дуже мало. два комплекти гуми на дисках. два ключі. не фарбоване. без сколів та царапин. жк панель приладів, старт/стоп, без ключовий доступ, підігріви сидінь передні, тепловий насос, підігрів лобового скла, адаптивний круїз контроль, омивач фар, автоматичні прилади дощу та світла. дві зарядки. карплей. асистент. в плюсову температуру запас ходу 280км в зимку до 200км. підтримує додаток фольцваген що дає можливість керувати в телефоні час заряджання, включати та виключати обігрів салону, gps навігація."
vw,egolf,https://auto.ria.com/uk/auto_volkswagen_e_golf_36771057.html,2024-12-16-14-10,8500, volkswagen e-golf 2016, vii покоління/typ 5g, vii покоління/typ 5g,,,2016,-1,99,-1,1,-1,Львів,продам власне авто. стан дуже хороший. більше деталей за телефоном.
