brand,model,link,date,price,title,subtitle,f1,f2,f3,year,hp,range,kp,dtp,fuel,location,desc
bmw,series7,https://auto.ria.com/uk/auto_bmw_7_series_37348748.html,2024-12-16-14-11,171000, bmw 7 series 2022, g70 • 760i mhev steptronic (544 к.с.) xdrive • m package, g70 , 760i mhev steptronic (544 к.с.) xdrive , m package,2022,544,11,1,1,1,Київ,"автомобіль приганяв і робив усе під себе, другий колір плівкою + захисна плівка антигравійна, кераміка на кузов, на шкіру салону.на гарантію ставлю на авт баварії.найповніша з усіх можливих комплектацій:рекупераційна система (м'який гібрид)abgasnorm ulevtoсистема обігріву рульового колесаспортивна акппсистема сигналізаціїдистанційне керуваннямногофункц. сидіння водія та пров. пас.механізм ав.розблокування баг.відділеннярадіоприймач bmw для сша супутниковий радіоприймач bmwteleservicesшкіряне кермо в м-стиліshadow-line із дзеркальним блискомвиконання для спекотних країнвиконання для країн із холодним кліматомакустич.попередж.неприст.ременя безоп.dummy-salapaнапис на панелі приладів, англ.холодоагент r1234yfідентифікаційний номер видно зовніуправління кріпленням номерного знакаm sport exterieurumfaengeпакети обробки салону m sportremote engine startbmw/с диск aerodynamik 909m stdіндикація тиску в шинахнабір для ремонту шинінтегральне активне кермом спорт пакет proавтоматичні дверіbmw кристальна фара iconic glowвідсутність зовнішньої доп.спортивне гальмо м, чорне глянцевепанорамний скляний дах sky loungeсонцезахисна штора 3д/бокцен.древ.дзерк.древ.дуба сірий-мет.глянц.сидіння пд з вентиляцієюкондиціонер сидіння 3дсист.з люком д.перевезення довгом.предм.мультифункціональні задні сиденняскляна накладка crafted clarityexecutive lounge seatingexecutive lounge fondkonsoleбагажна система travel& comfortпакет waermekomfortмасажна функція для задньої частини салонумасажна функція для керування. і пас пд декодир.сист.упр.неослепл.дальне світло.driving assistantпомічник руху на магістраліасистент паркування professionalconnected drive servicesconnected package professionalbowers& wilkins high end sound systemfond entertainment experienceлоток для бездротової зарядкиперсональна esimbmw live кокпіт professionalbmw natural interactionm sportpaket pro$, usdt"
bmw,series7,https://auto.ria.com/uk/auto_bmw_7_series_37486627.html,2024-12-16-14-11,13400, bmw 7 series 2011, f02 • 740li steptronic (326 к.с.) • base, f02 , 740li steptronic (326 к.с.) , base,2011,326,290,1,1,1,Запоріжжя,"максимальная комплектація: дотяжки всіх дверей безключовий доступ проекція на лобове скло цифрова панель приладів адаптивний круїз контроль утримання у смузі попередження про зіткнення мультимедійний lcd дисплей навігація 4-х зонний клімат контроль передні комфортні сидіння з пам'яттю положення, підігрівом та вентиляцією підігрів сидінь другого ряду камера 360 парктроніки помічник паркування електропривод багажника"
bmw,series7,https://auto.ria.com/uk/auto_bmw_7_series_35442762.html,2024-12-16-14-11,7500, bmw 7 series 2000, e38 (fl), e38 (fl),,,2000,-1,483,1,0,0,Чернівці,
bmw,x1,https://auto.ria.com/uk/auto_bmw_x1_37612304.html,2024-12-16-14-11,45999, bmw x1 2023, u11 • 18d steptronic (150 к.с.) sdrive • m sport, u11 , 18d steptronic (150 к.с.) sdrive , m sport,2023,150,48,1,0,0,"Вінниця, Обїздне шоссе, в. Менделєєва 56","офіційний автомобіль, від одного власника. чистий 2023 рік.на гарантії!! стан нового авто!!надзвичайно бережна експлуатація.абсолютно цілий автомобіль в рідній фарбі.оригінальний пробіг, обслуговування виключно в офіційного дилера.хороша комплектація:- пакет m sport, адаптивна м підвіска, акустика harman kardon, карплей, спортивні сидіння, панель приладів luxury, м-руль, shadow line, чорна стеля, м-спорт екстер'єр, м-спорт інтер'єр, доступ без ключа, адаптивна лед оптика, автодальнє світло, бездротова зарядка смартфона з охолодженням пристрою, підігрів керма, електропривід кришки багажника, навігація та багато іншого.нова зимова гума + комплект літньої.всі ключі в наявності.готова до будь-яких перевірок на сто.повний юридичний супровід при покупці авто.можливий обмін на ваш автомобіль."
bmw,x1,https://auto.ria.com/uk/auto_bmw_x1_35183788.html,2024-12-16-14-11,18700, bmw x1 2015, f49 • 20li at (192 к.с.) xdrive • base, f49 , 20li at (192 к.с.) xdrive , base,2015,192,100,1,1,1,"Київ, вулиця Володимира Брожка, 19","рестайлінгова модель 2016!автомобіль в ідеальному стані!led-оптикаадаптивне світлобезключовий доступкнопка start/stopрежими sport comfort ecoпреміум акустика-широкий монітор (nbt evo) розширена gps-навігаціяdvd, tv, usb, aux, bluetooth.панорамний дахчорна стеляr18 дискипідігрів сидіньпам'ять сидіньелектро кришка багажника"
bmw,x1,https://auto.ria.com/uk/auto_bmw_x1_37323744.html,2024-12-16-14-11,14999, bmw x1 2014, e84 (fl) • 18d аt (143 к.с.) sdrive, e84 (fl) , 18d аt (143 к.с.) sdrive,,2014,143,101,1,0,0,"Одесса, пр-т. Небесної Сотні, 2","офіційний автомобіль з повною сервісною історією. пробіг повністю підтверджень.475 колір кузова ""металік"" - black sapphire (чорний сапфір)lug9 оббивка салону зі шкіри 'nevada' - black/зі шкіряною окантовкою grey-red205 автоматична трансмісія з функцією steptronic та адаптивними налаштуваннями216 servotronic (кермо з змінним зусиллям на кермі в залежності від швидкості руху)249 мультифункціональна система на рульовому колесі255 спортивне кермо з шкіряною оббивкою258 покришки runflat (що дозволяють продовжувати рух при миттєвій втраті тиску)3ag камера заднього виду (на центральному дисплеї відображається вигляд позаду автомобіля)3ap сонцезахисна смуга на вітровому склі сірого кольору386 релінги на даху чорного кольору4ae зсувний передній підлокітник (з вбудованою розеткою на 12 v та висувним підсклянником)4at планки в салоні з лакованим покриттям чорного кольору4u2 режим керування 'eco pro'402 панорамний скляний люк420 сонцезахисне скління (тонування заднього бічного скла та заднього вікна)423 велюрові килимки в салоні428 знак аварійної зупинки та аптечка (обов'язкова опція для ринку україни)430 дзеркала заднього виду з автозатемненням (включаючи електроприведення складання)431 салонне дзеркало заднього виду з автозатемненням481 спортивні передні сидіння з електрорегулюванням бічної підтримки спинки493 ""пакет ""відділення для зберігання""""502 система омивання фар508 система допомоги при паркуванні (pdc), ззаду та спереду521 датчик дощу та освітленості522 біксенонові фари (забезпечують найкраще освітлення дороги)534 автоматичний клімат-контроль544 круїз-контроль з функцією гальмування563 розширений пакет освітлення салону6nh пристрій hands-free з інтерфейсом usb – для мобільного телефону з bluetooth609 навігаційна система professional. центральний дисплей 8.8"", керування за допомогою idrive620 система голосового керування7ac пакет sportline"
bmw,x1,https://auto.ria.com/uk/auto_bmw_x1_36310681.html,2024-12-16-14-11,14400, bmw x1 2014, e84 (fl) • 28i at (245 к.с.) xdrive • base, e84 (fl) , 28i at (245 к.с.) xdrive , base,2014,245,182,1,1,1,"Одеса, Академика Глушко 31а","у продажу bmw x1 x drive 28i, 2014 рік, кросовер, повний привід, акпп, 2.0 бітурбо, бензин, пробіг 182 т. км.пропонуємо популярний позашляховик bmw x1 x drive 28і в гарній комплектації в яку входять автоматична коробка перемикання передач, повний привід, клімат контроль 2-х зонний, шкіряні електро сидіння з підігрівами та пам'яттю, панорамний люк , круїз-контроль, датчики світу та дощу, вибір режима руху(eco-pro-normal),топова оптика - адаптивний біксенон + led, допомога при спуску, обігрів переднього та заднього скла, abs, esp, isofix, start-stop, механічний ручник та багато інших преміум функцій. мінімальні пошкодження, ціла безпека.дзвоніть прямо зараз для отримання додаткової інформації.також є можливість обміну вашого авто, придбання авто в розстрочку. інші варіанти авто в наявності або під замовлення дивиться на нашому сайті. перевірка авто на будь якому сто. допомога в переоформлені."
bmw,x1,https://auto.ria.com/uk/auto_bmw_x1_35913213.html,2024-12-16-14-11,13400, bmw x1 2011, e84, e84,,,2011,-1,117,1,0,1,Київ,продаю автомобіль 2011 рокуавтівка куплена в українів дтп не бувавтосалони прошу не турбувати !
bmw,x1,https://auto.ria.com/uk/auto_bmw_x1_37611346.html,2024-12-16-14-11,13000, bmw x1 2010, e84, e84,,,2010,-1,214,1,0,0,Луцьк,"супер автомобіль.економний, зручний, приємно керується, динамічний.bmw автомобіль, що приносить задоволення. вчасно обслуговувалось та якісно доглянуто."
bmw,x1,https://auto.ria.com/uk/auto_bmw_x1_32315822.html,2024-12-16-14-11,15000, bmw x1 2013,,,,,2013,-1,323,1,0,1,Хуст • Закарпатська обл.,"х1 в чудовому стані.проведено повне то.замінені всі масла та рідини.замінені всі амортизатори,колодки та тормозні диски.два комплекти резини(літня-ранфлети).заводська система покращеного кондиціонування.можливі встановлення таймерів на прогрів та охолодження салону.ручки відкривання дверей мають підсвітку в темну пору часу.повний привід.250 кінських сил(твін турбо).деталі по телефону та при огляді.авто варте уваги та ""своїх"" грошей.дякую за увагу)"
bmw,x1,https://auto.ria.com/uk/auto_bmw_x1_37385191.html,2024-12-16-14-11,18300, bmw x1 2016, f48 • 25d at (231 к.с.) xdrive • base, f48 , 25d at (231 к.с.) xdrive , base,2016,231,145,1,1,1,Івано-Франківськ,"автомобіль у хорошому стані ! авто купляли рік назад , для себе не на продаж ! обслуговувалось все вчасно , та якісними запчастинами ! на даний момент робити нічого не потрібно ! більше інформації надам по телефону !"
bmw,x1,https://auto.ria.com/uk/auto_bmw_x1_37487658.html,2024-12-16-14-11,12000, bmw x1 2014, e84 (fl), e84 (fl),,,2014,-1,225,1,1,1,Івано-Франківськ,всі деталі за телефоном.
bmw,x1,https://auto.ria.com/uk/auto_bmw_x1_37487483.html,2024-12-16-14-11,22500, bmw x1 2017, f48 • 28i at (245 к.с.) xdrive • base, f48 , 28i at (245 к.с.) xdrive , base,2017,245,49,1,1,1,Дніпро (Дніпропетровськ),"коментарі (в т.ч. через whatsapp) не читаю!!! тільки жива розмова!торг біля капота авто.2018 bmw x1 xdrive28i2017 рік виробництва. 2018 модельний рік. перша реєстрація в сша 30.08.2018 року.у відмінному стані! в дуже гарному кольорі.48000км пробіг. є carfax.автівка не плавала!запах нової автівки в салоні, без перебільшення ідеальний стан! все в ідеалі!!! всі деталі в заводському фарбуванні, жодного підкрасу! замінені ліва передня дверка і ліве переднє крило в колір (жодного дтп не було в сша, просто поїхали задом з відчиненою дверкою). замінено масло і всі фільтра. готовий до любих перевірок!довстановлено:рестайлінговий бамперfull led фари з переду і з заду європа! жовті повороти, і туманка.carplay бездротовийкомплектація автомобіля:•convenience package:внутрішнє та зовнішнє дзеркала водія з автоматичним затемненнямдзеркало заднього виду з автозатемненнямкомфортний доступ без ключапакет світильниківпоперекова опорапанорамний люкдзеркала з електроприводомуніверсальний відкривач гаражних воріт•xline:18-дюймові y-подібні колеса, стиль 569 із всесезонними шинамичорна глянцева окантовка з перламутрово-хромованим акцентомчорний sensatec•додатково:комфортний пакетпідігрів передніх сидінь і керманавігація бізнесспортивні сидіння•стандартна комплектація:додаткові розетки на 12 врозширена інформація про дорожній рух у реальному часісистема сигналізаціївсесезонна гумадах антрацитового кольоруbmw assist ecallbmw teleservicesавтономний підігрівач (фен)служби connecteddriveденні ходові вогнідвозонний автоматичний клімат-контрольдинамічний круїз-контрольпідлогові килимкипідігрів рульового колесапідігрів передніх сидіньзвукова система hi-fiвбудований програвач компакт-дисківматове хромоване зовнішнє оздобленнябагатофункціональне кермопередні сидіння з електроприводомелектропривід дверей багажниказатемнене заднє склокамера заднього видурейлінги на даху з сатинового алюмініюшини runflatконтроль тиску в шинах"
bmw,x3,https://auto.ria.com/uk/auto_bmw_x3_37139637.html,2024-12-16-14-11,9500, bmw x3 2012, f25 • 28i at (245 к.с.) xdrive • base, f25 , 28i at (245 к.с.) xdrive , base,2012,245,191,1,1,1,"Біла Церква, Сухоярська 11а","продаж за готівку або в лізинг | кредитгарний автомобіль. пригнаний з америки без дтп. авто обслужене, готове до експлуатації. не потребує додаткових вкладень. запрошуємо на тест-драйв!перший внесок від 3 300$термін від 12 до 36 місяцівавто знаходиться у вашому користуванні з першого дня!без довідок про доходи! тільки паспорт та код!з будь-якою кредитною історією!наша адреса:м. біла церква вул. сухоярська 18""авторинок"""
bmw,x3,https://auto.ria.com/uk/auto_bmw_x3_37349212.html,2024-12-16-14-11,28300, bmw x3 2018, g01 • 30i at (252 к.с.) xdrive • base, g01 , 30i at (252 к.с.) xdrive , base,2018,252,67,1,1,1,Львів,"приїхала з америки з цілою безпекою, пошкоджено було тільки центральні деталі на передньому бампері. бампер залишився рідний, жодна деталь не фарбована. він код і карфакс доступні. технічно і візуально в ідеалі! комплектація: x-line, оптика вmw led, чорна стеля, панорамний дах, люк, 4-ох зонний клімат, комфорт сидіння з ламаними спинками і пам'яттю, безключовий доступ, клімат, круїз, електропривід багажника, система старт-стоп, диски r19 та ін."
bmw,x3,https://auto.ria.com/uk/auto_bmw_x3_36490999.html,2024-12-16-14-11,14999, bmw x3 2012, f25, f25,,,2012,-1,153,-1,1,1,Бобровиця • Чернігівська обл.,власник по техпаспорту.
bmw,x3,https://auto.ria.com/uk/auto_bmw_x3_36200332.html,2024-12-16-14-11,49000, bmw x3 2019, g01, g01,,,2019,-1,110,1,0,0,Хмельницький,"пробіг оригінальний сервісований ,є всі відмітки та сервісні книжки ,по кузову без м’ятин та подряпин і жодного підкрасу , на 100тис пройшла повне то , по салону , як нова , дуже динамічна та економічна . машина дійсно без перебільшення чудова і готова до будь-якої вашої перевірки на будь-якому вашому сто"
,,,,,,,,,,,,,,,,,
bmw,x3,https://auto.ria.com/uk/auto_bmw_x3_37488543.html,2024-12-16-14-11,10700, bmw x3 2011, f25 • 28i mt (258 к.с.) xdrive • base, f25 , 28i mt (258 к.с.) xdrive , base,2011,258,150,1,0,1,Лубни • Полтавська обл.,"неспішно продаю автомобіль. власник за документами. класний емоційний х3, на зимовій гумі (22 рік, на цей сезон ще вистачить), пройдено то з заміною рідин, фільтрів. питань по двигуну, коробці немає. є невеликі коцки по лкп, без іржі. зв?язок через месенджери: whatsapp, signal, telegram."
,,,,,,,,,,,,,,,,,
bmw,x3,https://auto.ria.com/uk/auto_bmw_x3_37611641.html,2024-12-16-14-11,25999, bmw x3 2016, f25 (fl), f25 (fl),,,2016,-1,183,1,0,0,"Стрий, Об'їзна дорога, Дуліби","авто в збереженому стані. все працює справно.зауважень по салоні та кузову немає.-—про нас--компанія car stryy спеціалізується на продажі автомобілів пригнаних з закордону та від власників.переваги car stryy полягає в тому що в нас присутні такі послуги як:- вигідний кредит/лізинг на авто- послуга trade-in- комісійний майданчик- страхування- тест драйв- перевірка на сто- перереєстрація на нового власника- полірування автомобілів- хімчистка авто- детейлінг- витягування в'ятиндане авто ви можете оглянути завітавши до нас за адресою: об?їзна дорога, с.дуліби, львівськаобласть.працюємо ми без вихідних з 09:00-18:00"
,,,,,,,,,,,,,,,,,
bmw,x3,https://auto.ria.com/uk/auto_bmw_x3_37611495.html,2024-12-16-14-11,7800, bmw x3 2006, e83 (fl) • 25i at (218 к.с.) xdrive • base, e83 (fl) , 25i at (218 к.с.) xdrive , base,2006,218,330,1,0,1,Київ,"зимова гума,авто в доброму стані!все працює!усі питання по телефону!!"
bmw,x5,https://auto.ria.com/uk/auto_bmw_x5_37612551.html,2024-12-16-14-11,16600, bmw x5 2007, e70 • 3.0d at (235 к.с.) • base, e70 , 3.0d at (235 к.с.) , base,2007,235,275,1,0,0,"Стрий, вул.Болехівська 47а","id30252можливий продаж в кредит та через криптовалюту.пропонуємо такі послуги:- доставка авто з сша, канади, європи;- перереєстрація авто на нового власника;- перевірка авто;- оформлення авто в кредит."
bmw,x5,https://auto.ria.com/uk/auto_bmw_x5_37382159.html,2024-12-16-14-11,38400, bmw x5 2017, f15 • 35d steptronic (286 к.с.) xdrive • m package, f15 , 35d steptronic (286 к.с.) xdrive , m package,2017,286,128,1,1,0,Дніпро (Дніпропетровськ),"чудове авто в максимальній комплектаціі.комфортні сидіння,багатозонний клімат контроль,проєкція на лобове скло,максимальна оптика та багато іншого..."
bmw,x5,https://auto.ria.com/uk/auto_bmw_x5_37612516.html,2024-12-16-14-11,12999, bmw x5 2005, e53 (fl) • 3.0d at (218 к.с.) • base, e53 (fl) , 3.0d at (218 к.с.) , base,2005,218,360,0,0,0,Теофіполь • Хмельницька обл.,"гарний обслужений х, всі деталі по телефону!"
