brand,model,link,date,price,title,subtitle,f1,f2,f3,year,hp,range,kp,dtp,fuel,location,desc
vw,cc,https://auto.ria.com/uk/auto_volkswagen_cc_passat_cc_37489219.html,2024-12-16-14-09,9200, volkswagen cc / passat cc 2010, i покоління • 2.0tsi mt (210 к.с.) • base, i покоління , 2.0tsi mt (210 к.с.) , base,2010,210,229,0,1,1,Запоріжжя,"дах затягнутий чорною плівкою.передні і задні фари відполіровані, задні затягнуті в темну плівку.з америки було вм`яте передне праве крило, витягнули без пiдкрасiв.технічно автомобіль повністю справний.в авто замінено всі форсунки та прокладки в серпні місяці.замiна маслa кожні 6-7 тисяч.!!! вирізано каталізатор, автомобіль з басистим вихлопом + встановлено нульовик.торг при зустрічі."
,,,,,,,,,,,,,,,,,
,,,,,,,,,,,,,,,,,
vw,cc,https://auto.ria.com/uk/auto_volkswagen_cc_passat_cc_37151665.html,2024-12-16-14-09,9100, volkswagen cc / passat cc 2011, i покоління, i покоління,,,2011,-1,199,1,1,1,Червоноград • Львівська обл.,
vw,cc,https://auto.ria.com/uk/auto_volkswagen_cc_passat_cc_34930094.html,2024-12-16-14-09,10300, volkswagen cc / passat cc 2014, 2.0tsi mt (210 к.с.) • sport life, 2.0tsi mt (210 к.с.) , sport life,,2014,210,124,0,1,1,Львів,"авто у доброму стані, не бите: було замінено масляний насос та зроблено обслуговування.кузов вхорошому стані, є сколи на бампері,перекрашений дах в чорний колір, оскільки при транспортуванні приїхала з царапиною на даху.деталі по телефон уабо вайберу."
vw,cc,https://auto.ria.com/uk/auto_volkswagen_cc_passat_cc_37612270.html,2024-12-16-14-09,13700, volkswagen cc / passat cc 2013, i покоління (fl) • 2.0tdi dsg (184 к.с.) 4motion • r-line, i покоління (fl) , 2.0tdi dsg (184 к.с.) 4motion , r-line,2013,184,214,1,0,0,"Київ, вул. Балтійський провулок 20","повнопривідний дизельний passat cc у відмінній комплектації та без дтпавтомобіль з-під одного господаря, з усією сервісною історією з чеками та актами. на 100% обслужений автомобіль.фарбовано 2 елементи з косметичних міркувань, жодних дтп.оснащений найпотужнішим дизельним 2.0 двигуном на 184 к.с. у парі з автоматичною коробкою dq250 та системою повного приводу.єкологія на місці!з плюшок комплектації - шкіряний салон nappa (не плутати з китайськими напів пластиковими) , панорама, пам'ять сидінь, адаптивна підвіска зі зміною жорсткості, підігрів сидінь, камера заднього виду, датчики світла та дощу.візуально та технічно passat- в відмінному станіу ходу - дуже приємна машина, без сторонніх звуківклімат справнийсалон у хорошому станіжодного рижика на кузові або дні.двигун та акпп сухі, без підтікань чи запотіваньходова обслужена , ніяких сторонніх звуківви можете придбати цей автомобіль у кредит або лізинг (перший внесок від 25%, терміном до 5 років)ми знаходимося за адресою м.київ, провулок балтійський, 20, працюємо без перерв та вихідних з 10:00 до 19:00 (нд за домовленістю)автомобіль перевіряється в сервісах, яким ви довіряєте, у зручний для вас час. розрахунок лише після повного переоформлення в мрев.в наявності завжди більше 70 автомобілів, будемо раді вас бачити!"
vw,cc,https://auto.ria.com/uk/auto_volkswagen_cc_passat_cc_37488724.html,2024-12-16-14-09,9900, volkswagen cc / passat cc 2012, i покоління (fl), i покоління (fl),,,2012,-1,185,1,1,1,Київ,"авто в нормальному стані купував з мінімальними пошкодження (була замина бампера, крыла, фари,) є всі необхідні опції для комфортності експлуатації. торг мінімальними при огляді."
vw,cc,https://auto.ria.com/uk/auto_volkswagen_cc_passat_cc_30876779.html,2024-12-16-14-09,11000, volkswagen cc / passat cc 2012, i покоління (fl), i покоління (fl),,,2012,-1,60,1,1,1,Новоселиця • Чернівецька обл.,"автомобиль в нормальном состоянии,пригнан из сша,покупал лично для себя,первая регистрация,которая стоит не дёшево,машина очень резвая,новая зимняя резина,по поводу остальных вопросах звоните по телефону(viber)"
vw,cc,https://auto.ria.com/uk/auto_volkswagen_cc_passat_cc_37609993.html,2024-12-16-14-09,7950, volkswagen cc / passat cc 2013, i покоління (fl) • sport life, i покоління (fl) , sport life,,2013,-1,195,1,1,1,Тернопіль,продам своє авто в дуже хорошому станітехнічний стан авто на тверду 5жодної помилки на щитку приборівлюбий вид переоформлення
vw,cc,https://auto.ria.com/uk/auto_volkswagen_cc_passat_cc_37203765.html,2024-12-16-14-09,12500, volkswagen cc / passat cc 2014, i покоління (fl) • 3.6fsi dsg (300 к.с.) 4motion, i покоління (fl) , 3.6fsi dsg (300 к.с.) 4motion,,2014,300,220,1,1,1,Дніпро (Дніпропетровськ),"авто повністю на ходу, все працює, запчастини замінені. додаткових вкладень не потребує. є додатковий комплект гуми."
,,,,,,,,,,,,,,,,,
vw,golf,https://auto.ria.com/uk/auto_volkswagen_golf_37204018.html,2024-12-16-14-09,11400, volkswagen golf 2014, vii покоління/typ 5g • 1.6 tdi dsg (105 к.с.), vii покоління/typ 5g , 1.6 tdi dsg (105 к.с.),,2014,105,219,1,0,0,"Львів, Щирецька 36","надаємо кредит, обмін, тест драйв."
vw,golf,https://auto.ria.com/uk/auto_volkswagen_golf_37057846.html,2024-12-16-14-09,11200, volkswagen golf 2016, vii покоління/typ 5g, vii покоління/typ 5g,,,2016,-1,105,0,1,1,Буча • Київська обл.,"продам volkswagen golf 1.8 tsi.авто в гарному стані, без пробігу по україні.зроблено то,заміна масел,фільтрів,антифрізу.без капітало вкладень сів поїхав.відновлена безпека.можливий обмін,на обмін. дорожче."
,,,,,,,,,,,,,,,,,
,,,,,,,,,,,,,,,,,
vw,golf,https://auto.ria.com/uk/auto_volkswagen_golf_37612583.html,2024-12-16-14-09,6850, volkswagen golf 2008, v покоління/typ 1k, v покоління/typ 1k,,,2008,-1,325,1,0,0,Рівне,"volkswagen golf 5 2.0 дизель, 125 kw.комплектація gt sport.офіційно куплена в салоні в україні в 2008 році.є все для комфортної їзди.мотор працює ідеально, вся екологія на місці, нічого не вирізали і не перешивали.сажевий фільтр на місці.коробка перемикає чітко.ходова частина без посторонніх звуків все на відмінно, не грюкає не стукає.по електриці все працює, ніяких чеків, помилок немає. кожна кнопочка працює.кондиціонер заправлений.всі вікна, включаючи лобове рідні без сколів і тріщин.стоїть нова резина зимова.оригінальний пробіг 100%.сервісна книга присутня.2 оригінальні ключі.автомобіль повністю обслужений.вкладень ніяких на даний момент не потребує.хто шукає дійсно хорошого гольфа, запрошую на тест-драйв і огляд.торг біля автомобіля.телефонуйте, запитуйте що вас цікавить, відповім на всі ваші запитання стосовно машини по телефону."
,,,,,,,,,,,,,,,,,
vw,golf,https://auto.ria.com/uk/auto_volkswagen_golf_37612552.html,2024-12-16-14-09,4700, volkswagen golf 2002, iv покоління/typ 1j, iv покоління/typ 1j,,,2002,-1,260,0,0,1,Вільнянськ • Запорізька обл.,"машина каждый день находится в использовании, есть мелкие косяки по кузову, салон на 4, ходовая в норме, двигатель и коробка без претензий, только переоформление."
,,,,,,,,,,,,,,,,,
vw,golf,https://auto.ria.com/uk/auto_volkswagen_golf_37458029.html,2024-12-16-14-09,5900, volkswagen golf 2006, v покоління/typ 1k, v покоління/typ 1k,,,2006,-1,199,0,0,1,"Кривий Ріг, ул. Льотчиків 22","aвтомобіль у гарному стані, обслугований-вкладень не вимагає. реальному покупцеві можливий торг. можливий обмін авто з нашою або вашою доплатою."
vw,jetta,https://auto.ria.com/uk/auto_volkswagen_jetta_37409005.html,2024-12-16-14-09,7950, volkswagen jetta 2014, vi покоління (fl) • 2.0 мт (115 к.с.), vi покоління (fl) , 2.0 мт (115 к.с.),,2014,115,310,0,1,1,Тернопіль,звязок тільки через вайбер або вацап
vw,jetta,https://auto.ria.com/uk/auto_volkswagen_jetta_37612298.html,2024-12-16-14-09,14000, volkswagen jetta 2018, vii покоління, vii покоління,,,2018,-1,111,1,1,1,Охтирка • Сумська обл.,"автомобіль в гарному стані, пригнана з канади з мінімальним ушкодженням, була на ходу. ( безпека ціла, подушки не стріляні) двигун і коробка працюють добре і без проблем, ходова частина, підвіска в доброму стані, салони як новий , не затертий і охайний, в машині працює все. рідний пробіг, я власник, переоформлення. люба перевірка на сто.торг присутній біля машини."
vw,jetta,https://auto.ria.com/uk/auto_volkswagen_jetta_35076634.html,2024-12-16-14-09,12100, volkswagen jetta 2014, vi покоління (fl) • 1.8 tsi at (172 к.с.), vi покоління (fl) , 1.8 tsi at (172 к.с.),,2014,172,147,0,1,1,Київ,привозив до війни з сша як сімейне авто для себе і дівчини.останнє то було на 142тис - змінено масло та фільтра. до технічного стану питань немає.комплектація se.диски r17.питання за телефоном. реальному покупцю торг на місці. перевірки на сто - ок.
vw,jetta,https://auto.ria.com/uk/auto_volkswagen_jetta_37479971.html,2024-12-16-14-09,12900, volkswagen jetta 2017, vi покоління (fl), vi покоління (fl),,,2017,-1,71,0,1,1,Дніпро (Дніпропетровськ),"продам vw jetta gli, заміна масла кожні 5 тис/км., нова підвіска з заниженням, мотор сток, механіка. поміняні фари ( нові), акумулятор. по машині нічого не треба робити."
vw,jetta,https://auto.ria.com/uk/auto_volkswagen_jetta_37483763.html,2024-12-16-14-09,9000, volkswagen jetta 2014, vi покоління, vi покоління,,,2014,-1,195,1,1,1,Львів,"привіт друзі.продається ось така красуня volkswagen jetta 2014????????????.в хорошому стані має все для комфортної їзди????????????,також радує розходом,всі розхідники помінняні ходова обслужена,мотор 1,8 бензин дуже чуйний до педальки газу,пробігла ця красуня 190 тисяч,хороша резина.тож кого цікавить така красуня звертайтеся.ціна 9400.торгтакож цікавить обмін на кросовер,пропонуйте різні варіантителефонуйте на вайбер"
vw,jetta,https://auto.ria.com/uk/auto_volkswagen_jetta_37611906.html,2024-12-16-14-09,8900, volkswagen jetta 2014, vi покоління (fl) • 2.0 aт (115 к.с.) • base, vi покоління (fl) , 2.0 aт (115 к.с.) , base,2014,115,128,1,1,1,"Львів, вул. Кульпарківська, 222/2","id30190даний автомобіль можна оглянути завітавши у наш автосалон, який знаходиться у м. львів по вул. кульпарківська 222.компанія бос авто пропонує такі послуги як:- кредит !- лізинг !- оплата криптовалютою !- доставка авто з сша, канади, європи !- перереєстрація авто на нового власника !- перевірка авто на сто !- продаж авто в кредит та лізинг !- оплата криптовалютою !- страхування !- обмін на авто !- тест-драйв !телефонуйте та наші менеджери з радістю нададуть відповідь на всі ваші запитання.чекаємо вас за адресою м. львів, вул. кульпарківська 222 наш графік роботи пн-пт – 10:00 год – 19:00 год. суб. – 10:00 год. – 18:00 год. нд. – 10:00 год. – 16:00 год."
,,,,,,,,,,,,,,,,,
vw,jetta,https://auto.ria.com/uk/auto_volkswagen_jetta_37611248.html,2024-12-16-14-09,7500, volkswagen jetta 2013, vi покоління • 2.0 mpi mt (115 к.с.), vi покоління , 2.0 mpi mt (115 к.с.),,2013,115,265,1,1,1,Івано-Франківськ,без торгу
vw,jetta,https://auto.ria.com/uk/auto_volkswagen_jetta_35982202.html,2024-12-16-14-09,7999,             volkswagen jetta 2011        , vi покоління , vi покоління ,,,2011,-1,260,1,1,1,Миколаїв,"   читаємо поважливо !!! торг біля капоту, тільки адекватним людям! по вин 2011, виїхала з салону в 2012 мотор коробка у відмінному стані, плавні перемикання без стусанів, мотор не димить, олія не жере. диски від мерседес, нові колодки. коробка автомат!! (6 ступка) каталізатори не вирізалися! гума зима! свіжий тонер по колу. електро підігрів дзеркал заднього виду електро регулювання дзеркал заднього виду. багажник місткий. олії/фільтру мінялис (свіже то) двигун 2.0 атмосфера, дуже надійний, і перевірений часом двигун. в обслуговуванні не дорога! машини на ходу кожен день. детальніше телефонувати  "
vw,jetta,https://auto.ria.com/uk/auto_volkswagen_jetta_36264495.html,2024-12-16-14-09,13500, volkswagen jetta 2019, vii покоління • 1.4 tfsi at (150 к.с.) • base, vii покоління , 1.4 tfsi at (150 к.с.) , base,2019,150,86,1,1,1,Львів,"86 000 км, 1.4 бензин 150 к.с., автомат, з канади, професійно відремонтовані пошкодження"
vw,passat,https://auto.ria.com/uk/auto_volkswagen_passat_37204277.html,2024-12-16-14-09,16100, volkswagen passat 2015, b8 • 2.0tdi dsg (150 к.с.), b8 , 2.0tdi dsg (150 к.с.),,2015,150,295,1,0,0,Дніпро (Дніпропетровськ),"авто повність обслужене, готове до перевірки на будь-якому сто.авто пригнане з німеччини з пробігом 150 000. пройдено велике то на 240 000 (додаткове заміна щеплення, встановлено новий акумулятор). авто на 100% в гарному стані. автомобіль частково покрито бронь плівкою бампер, капот, криша. в наявності два комплекта резини, в гарному стані (зима на металевих дисках 16 розміру, літо на 17 легкосплавні диски. в авто не палили. сімейне авто, використовували для дальніх подорожей багатодітною сім’єю. встановлено додатково сигналізація з функціями керування з мобільного телефону. всю додаткову інформацію відправлю в особисті повідомлення по запиту в вайбер, телеграм."
vw,passat,https://auto.ria.com/uk/auto_volkswagen_passat_37204545.html,2024-12-16-14-09,18000, volkswagen passat 2016, b8 • 2.0tdi dsg (150 к.с.) 4motion, b8 , 2.0tdi dsg (150 к.с.) 4motion,,2016,150,114,1,0,0,Тернопіль,"в україні перший власник (машина спочатку була оформлена на батька), наїздив по україні лише 15 тис.км. автомобіль брався для сімейних поїздок (для роботи та поїздок містом є ще два автомобіля). автомобіль повністю обслужений, все рідне, мінялось лише масло оригінальне, та грм з помпою. пробіг оригінальний, є вебасто. салон та руль як нова машина, їздив без накидок і не робив дітейлінг, мотор не митий, щоб бачили чи є якісь дефекти. фари full led. сидіння з пам'яттю та масажем. передні сидіння з електроприводом. передні вікна подвійні, що забезпесить вам додаткову шумоізоляцію. чудова машина, без жодних вкладень. готовий до любих перевірок."
,,,,,,,,,,,,,,,,,
,,,,,,,,,,,,,,,,,
vw,passat,https://auto.ria.com/uk/auto_volkswagen_passat_36707168.html,2024-12-16-14-10,21499, volkswagen passat 2018, b8 • 2.0tdi dsg (150 к.с.) • premium r-line, b8 , 2.0tdi dsg (150 к.с.) , premium r-line,2018,150,149,1,0,0,Коломия • Івано-Франківська обл.,"свіжо пригнати авто з німеччини!можливий обмін ( ціна на обмін 25$ )-volkswagen passatн b8 r-line x2!-перша реєстрація авто 15.11.2018!- модельний рік 2019 !-комплектація r-line x2(зовнішній,та внутрішній)- 2 комплекта титанових дисків з ризиною ( літо , зима )-двигун 2.0tdi,110kw(150кс)!- 7ми ступенева коробка dsg dq381,3 двома мокрими щепленнями!-технічно в ідеальному стані;-кузов в рідному заводському окрасі (без підфарбувань)!!!-оригінальний пробіг 149тис.км !-обслуговуваннана на офіційному диллеріvolkswagen!- присутня вся сервісна історія,що підтверджується офіційним дилеромvolkswagen,також є всі роздруківки сервісів в фізичному вигляді!!!- full led оптика сама максимальна яка лиш може бути ,з функцією вирізання зустрічного транспорту;- присутні всі асистенти (тримання в смузі руху, запобігання зіткнення,розпізнавання пішоходів,розпізнавання дорожніх знаків,та в томи водія)-акустична система «dinaudio soundsystem» з сабвуфером;-віртуальна панель приладів «active info»display"" з функцією навігації ;-сенсорна мультимедіа""discover media pro"" з можливістю керування жестами;-камера задньго огляду;- apple car play та android auto ;-парктроніки передній,та задній;- підсвітка салону ""ambient lighting""- спортивний салон r-line,оздоблений шкірою""nappa"", з більш вираженою поперековою підтримкою;- напів електричне сидіння водія ergocomfort;- функція масажу сидіння водія ;- датчики сліпих зон;- підігрів дзеркал ;- підігрів передніх сидінь;-трьох зональний клімат контроль"" air careclimatronic""- активний круіз-контроль;- асестенти екстрерного гальмування ;- автоматичне складання дзеркал заднього огляду ;- функція автозатемнення дзеркал ;- заводське тонування ;- датчик світла ;- датчик дощу ;- aux, usb, bluetooh ;-розетка 220v!- легкосплавні диски r18 r-line(літня гума)- двійне скло ;- підрульові пелюстки ;та багато іншого , новий власник буде задоволений !!!всім миру та добра !!!!"
vw,passat,https://auto.ria.com/uk/auto_volkswagen_passat_36907421.html,2024-12-16-14-10,16300, volkswagen passat 2017, i покоління (fl)/nms, i покоління (fl)/nms,,,2017,-1,82,1,1,1,Кременчук • Полтавська обл.,"автомобіль в гарному стані, додаткових вкладень не потребує.перший власник з сша.автомобіль з мінімальними пошкодженнями і цілою безпекою!салон доглянутий після хімчистки.по кузову і технічно без зауважень.новий акумуляторпо комплектації:-чорний шкіряний салон-електро регулювання водійського сидіння-шкіряне мульти кермо-підігрів передніх сидінь-двозонний клімат контроль-круіз контроль-датчики мертвих зон-мультімедія з великим екраном-bluetooth aux usb cd-камера заднього огляду-датчик світла-led протитуманні фари-бортовий комп'ютер-центральний замок-диски r19пробіг 82.000т.км1vwdt7a39hc074051"
vw,passat,https://auto.ria.com/uk/auto_volkswagen_passat_34363891.html,2024-12-16-14-10,16900, volkswagen passat 2015, b8, b8,,,2015,-1,360,-1,0,0,Вінниця,"r-line 2.0 bitdi 4motion 176kwавтомобіль у відмінному технічному стані. пробіг оригінальний! замінений комплект грм. максимальна комплектація, чорна стеля! можливий торг біля авто!!!"
,,,,,,,,,,,,,,,,,
,,,,,,,,,,,,,,,,,
